{
  "$schema": "https://json-schema.org/draft/2020-12/schema",
  "$id": "https://design-governance.invalid/v1/research-brief.schema.json",
  "title": "Design Governance V1 — RESEARCH_BRIEF",
  "type": "object",
  "required": ["research_question", "decision_at_risk", "depth", "source_classes", "entries", "stop_condition", "uncertainty_before", "uncertainty_after"],
  "additionalProperties": false,
  "properties": {
    "research_question": {"type":"string","minLength":1},
    "decision_at_risk": {"type":"string","minLength":1},
    "depth": {"enum":["none","targeted","deep"]},
    "source_classes": {"type":"array","minItems":1,"items":{"type":"string","minLength":1}},
    "uncertainty_before": {"type":"string","minLength":1},
    "uncertainty_after": {"type":"string","minLength":1},
    "entries": {
      "type":"array",
      "minItems":0,
      "items": {
        "type":"object",
        "required":["source","source_status","source_date","source_class","reliability_basis","observed","retained","rejected","transformed","decision_changed","artifact_consequence","limit"],
        "additionalProperties":false,
        "properties": {
          "source":{"type":"string","minLength":1},
          "source_class":{"type":"string","minLength":1},
          "reliability_basis":{"type":"string","minLength":1},
          "observed":{"type":"string","minLength":1},
          "retained":{"type":"array","minItems":1,"items":{"type":"string","minLength":1}},
          "rejected":{"type":"array","items":{"type":"string","minLength":1}},
          "transformed":{"type":"string","minLength":1},
          "decision_changed":{"type":"string","minLength":1},
          "artifact_consequence":{"type":"string","minLength":1},
          "limit":{"type":"string","minLength":1},
          "source_status":{"enum":["verified_in_run","unverified_knowledge","user_source_unverified"]},
          "source_date":{"type":"string","minLength":1},
          "source_locator":{"type":"string","minLength":1},
          "rights_status":{"enum":["not_applicable","cleared","unknown","restricted"]}
        }
      }
    },
    "stop_condition":{"type":"string","minLength":1}
  }
}

